Nbr-Pers,,Pers EN,Perspective text EN,Core perspective EN,,Pers Fr,Perspective text Fr,Core perspective Fr,,Pers Nw,Perspective text Nw,Core perspective Nw
0,,0,0,0,,0,0,0,,0,0,0
1,,Grounding,"The Grounding Perspective represents the need to fulfill the most basic requirements for life, such as shelter, physical mobility, and security, as well as the basic human emotional need for kindness, toward oneself and others. For many people at any given time, this cluster of values may need less conscious attention as they already operate “in the background.” But it is also natural for Grounding values to become more important, requiring more attention in times of stress and significant life change, for example because of illness or accident or prolonged financial or social pressure. Stress can also result from positive life events, such as embarking on demanding educational programs, taking on job roles that require expanded competencies, or starting a new family. As its name says, this Perspective is needed to ground us in a solid foundation for life, on which all other values rest. We most often see Grounding Perspective values prioritized by people who are post-secondary students, young parents, and people who are experiencing destabilizing life conditions. Societies that do not sufficiently prioritize the Grounding Perspective may fail to adequately ensure the basic conditions for life for their citizens and dependents, resulting homelessness or population displacement, unsafe communities, or preventable public health problems. For some people, the choice of Grounding values expresses a more generalized concern for the fundamental well-being of others. We all need to consciously re-evaluate Grounding values at every stage of life, in order to build, maintain, and when necessary, re-build our life foundations.","When the Grounding is the most highly energized or “core” perspective, it requires us to pay attention to issues of personal health, basic security, and/or physical mobility. In times of crisis or prolonged stresses, paying attention to the values in this Perspective means changing the things in life that have negative impacts that one can control, or by seeking help. If Grounding values are being triggered by life choices that result in temporary trade-offs such as financial or physical insecurity, it can help to pay attention to mental health and well-being in the short term and find ways to put energy into actions that will support the eventual return to one’s most desired values perspective in the long term. In that situation, acknowledging the importance of these values and addressing them consciously can be a first step in returning to a more stable, secure life condition.",,Fondamentaux,"La perspective Fondamentaux représente le besoin de répondre aux exigences les plus élémentaires de la vie, telles que le logement, la mobilité physique et la sécurité, ainsi que le besoin émotionnel fondamental de bienveillance envers soi-même et les autres. Pour de nombreuses personnes à un moment donné, cet ensemble de valeurs, opèrent déjà « en arrière-plan » et, de ce fait, ne requièrent pas une attention consciente particulière. Mais il peut s’avérer que les valeurs de la perspective Fondamentaux deviennent plus importantes, exigeant plus d’attention. C’est le cas plus particulièrement en période de stress ou de changement de vie important comme, par exemple, à cause d’une maladie, d’un accident ou d’une situation de tension financière ou sociale prolongée. Le stress peut également résulter d’événements positifs de la vie, comme le fait de se lancer dans des études exigeantes, d’assumer un poste plus important nécessitant un élargissement de compétences ou encore de fonder une famille. Comme son nom l’indique, la perspective Fondamentaux est nécessaire pour se construire une base de vie solide sur laquelle reposeront toutes les autres valeurs. Ainsi, nous constatons souvent que les valeurs de la perspective Fondamentaux sont privilégiées par les étudiants, les jeunes parents, les personnes en transition professionnelle ou personnelle ou subissant des conditions de vie déstabilisantes. Les sociétés humaines n’accordant pas suffisamment d’importance à cette perspective et, de ce fait, négligeant de garantir de manière satisfaisante les conditions de vie des citoyens et de personnes à charge, produisent des problèmes tels que l’existence de sans-abris, les flux de migrants, les communautés dangereuses ou des problèmes de santé publique qui auraient pu être évités. Pour certaines personnes, le choix des valeurs de la perspective Fondamentaux exprime une préoccupation plus générale concernant le bien-être d’autrui. À chaque étape de notre vie, il est nécessaire pour nous tous de réévaluer consciemment ces valeurs, afin de construire, d’entretenir et, si nécessaire, de reconstruire les fondations de notre vie.","La perspective Majeure est celle qui, au quotidien, reçoit une grande part de notre attention et notre énergie. Lorsque celle-ci est la perspective Fondamentaux, il convient de prêter attention aux problèmes de santé, de sécurité de base et / ou de mobilité physique. En temps de crise ou de stress prolongé, se concentrer sur les valeurs de cette perspective signifie opérer les changements de vie afin d’éviter tout impact négatif que l’on pourrait contrôler, ou chercher l’aide qui convient. Si les valeurs de la perspective Fondamentaux sont activées par des choix de vie qui entraînent des sacrifices temporaires  tels qu’une insécurité financière ou physique, il peut être souhaitable de faire attention à sa santé mentale et à son bien-être à court terme en trouvant le moyen de consacrer de l’énergie à des actions destinées à faciliter le retour éventuel à une perspective des valeurs plus conforme à long terme avec les aspirations de la personne. Dans une telle cette situation, reconnaître l’importance des valeurs souhaitables et les adopter consciemment peut être une première étape vers un retour à des conditions de vie plus stables et plus sûres.",,Grounding,"The Grounding Perspective represents the need to fulfill the most basic requirements for life, such as shelter, physical mobility, and security, as well as the basic human emotional need for kindness, toward oneself and others. For many people at any given time, this cluster of values may need less conscious attention as they already operate “in the background.” But it is also natural for Grounding values to become more important, requiring more attention in times of stress and significant life change, for example because of illness or accident or prolonged financial or social pressure. Stress can also result from positive life events, such as embarking on demanding educational programs, taking on job roles that require expanded competencies, or starting a new family. As its name says, this Perspective is needed to ground us in a solid foundation for life, on which all other values rest. We most often see Grounding Perspective values prioritized by people who are post-secondary students, young parents, and people who are experiencing destabilizing life conditions. Societies that do not sufficiently prioritize the Grounding Perspective may fail to adequately ensure the basic conditions for life for their citizens and dependents, resulting homelessness or population displacement, unsafe communities, or preventable public health problems. For some people, the choice of Grounding values expresses a more generalized concern for the fundamental well-being of others. We all need to consciously re-evaluate Grounding values at every stage of life, in order to build, maintain, and when necessary, re-build our life foundations.","When the Grounding is the most highly energized or “core” perspective, it requires us to pay attention to issues of personal health, basic security, and/or physical mobility. In times of crisis or prolonged stresses, paying attention to the values in this Perspective means changing the things in life that have negative impacts that one can control, or by seeking help. If Grounding values are being triggered by life choices that result in temporary trade-offs such as financial or physical insecurity, it can help to pay attention to mental health and well-being in the short term and find ways to put energy into actions that will support the eventual return to one’s most desired values perspective in the long term. In that situation, acknowledging the importance of these values and addressing them consciously can be a first step in returning to a more stable, secure life condition."
2,,Family,"The Family Perspective is characterized by the importance of belonging to a group, whether it is your family, a social group, or the organization in which you work. For most of us, the first primary group is the family we grow up with and the initial social circles we are familiar with that establishes a sense of who we are. Family Perspective can also include “family of choice” beyond blood relations: neighbors, friends, guardians or cherished teachers or role models; people like co-workers with whom we spend extended time and develop familiarity. A Family Perspective connection may include any person or group with whom we have strong emotional ties. This can be especially important as we grow and mature within communities of people we choose to affiliate with because we may feel they share and express values that are deeply important to us. Within this perspective, the individual assumes some responsibility for his or her actions, but also depends on maintaining relationships with others in this primary group for guidance and support; or with those toward whom we feel it is our moral responsibility to guide and support. In this perspective we find basic personal development values like belief, honesty, and self-worth, which may appear early in life and remain as core values throughout life. Interaction values such as courtesy, fairness, loyalty, and respect belong to this perspective. Organizations and institutions may also share Family perspective, expressed in norms that prioritize loyalty to employees, for example with regard to secured job tenure and retirement programs, showing emotional connections in caring for co-workers or customers in times of need, and in shared celebrations, whether long-established traditions, or newly-created in order to express the value of genuine ties of emotion and belonging beyond the impersonal requirements of job descriptions. This is a Foundational perspective, through which we seek, both for ourselves and for others who are important to us, the stability of shared identity and the emotional satisfaction of belonging.","As your likely strongest, or “core” perspective, the Family perspective values receive most of your attention and energy day-to-day. Whether it is your family, a social group, or the organization in which you work, belonging to the group is likely to be the way you receive recognition and respect, which affirm your worth as a person, and it is likely you are energized by being able to reciprocate. This combination of giving and receiving can often be the case for people in the caring and service professions, at any level, who often value even strangers as they would family; or for people who treat any activity as an opportunity to give and receive basic human affirmation. Family is a Foundational life-perspective, and through this perspective you are likely to seek an emotionally stable life. However, you may experience insecurity if external conditions challenge that stability. Change often requires that we find ways to cope with value orientations different from our own. People having this core perspective may tend to look to a person or persons whom they view as having moral or positional authority for structure and guidance in important life matters; as a parent or in leadership roles you may also expect others to look up to you and expect yourself to provide stability and direction for those in your care. Circumstances of change, especially changes that challenge your authority, may be demanding a more impartial stance than you have previously been accustomed to. Such times provide opportunities for assessing if you are in need of building new skills, and if so, creating action steps to address your needs. In such times gathering around you the people you need to help you determine your growth choices may provide the most solid path toward re-establishing stability.",,Famille,"La perspective Famille se caractérise par l’importance accordée à l’appartenance à un groupe, que ce soit sa famille, un groupe social ou l’organisation dans laquelle on travaille. Pour la plupart d’entre nous, le premier groupe fréquenté est celui de la famille, dans laquelle nous grandissons, premier cercle social qui nous est familier donnant un sens à notre identité. La perspective Famille peut également inclure notre « famille de cœur » au-delà des relations de sang : voisins, amis, tuteurs, professeurs ou même les figures de proue que nous apprécions ; des gens comme des collègues avec lesquels nous passons du temps et développons une certaine intimité. Un lien de perspective Famille peut inclure toute personne ou tout groupe avec lequel nous avons des attaches émotionnelles fortes. Cela peut devenir particulièrement important au fur et à mesure que nous évoluons et mûrissons au sein des communautés de personnes avec lesquelles nous choisissons de nous rattacher. En effet, elles peuvent nous procurer un sentiment de partage et d’expression de valeurs profondément importantes pour nous. Dans cette perspective, l’individu assume une certaine responsabilité de ses propres actes, pour autant, pour ce qui est du conseil ou de l’assistance, il dépendra de sa relation avec son groupe d’appartenance ou des personnes avec lesquelles il estimera avoir une responsabilité morale. Des valeurs fondamentales de développement personnel telles la croyance, l’honnêteté et l’estime de soi font partie de cette perspective. Ces dernières peuvent se manifester tôt dans la vie et rester des valeurs primordiales tout au long de la celle-ci. Les valeurs d’interrelation telles que la courtoisie, l’équité, la loyauté et le respect font aussi partie de cette perspective. La perspective Famille peut également être celle de certaines organisations et institutions, en particulier lorsqu’elles accordent une place prioritaire à des principes tels que le comportement loyal envers les employés (par exemple sur la pérennité de l’emploi et les avantages de retraite), le tissage de liens émotionnels avec ses collègues ou ses clients – en cas de besoin –, la célébration partagée des réussites, etc. Au-delà des descriptions de poste impersonnelles, avec cette perspective l’entreprise s’efforce d’exprimer la valeur de véritables liens d’émotion et d’appartenance à travers des traditions anciennes ou nouvellement créées. Par le biais de cette perspective, nous recherchons, à la fois pour soi-même et pour ceux qui nous importent, la stabilité de l’identité partagée et la satisfaction émotionnelle de l’appartenance.","La perspective Majeure est celle qui, au quotidien, reçoit une grande part de notre attention et notre énergie. Lorsque celle-ci est la perspective Famille, qu’il s’agisse de sa famille, du groupe social ou de l’organisation dans laquelle nous évoluons, c’est vraisemblablement de notre appartenance que nous tirerons reconnaissance et respect, et qui, en tant que personne, affirmera notre valeur et, il est probable que nous tirions une certaine énergie de la possibilité de donner en retour. Cette association « donner et recevoir » se rencontre notamment dans professions de soins et de services dans lesquelles chacun, étranger ou non, est traité comme faisant partie de la famille. Cela va aussi pour les personnes qui considèrent leur activité comme le moyen de donner et de recevoir. La perspective Famille sera Majeure pour toute personne susceptible de rechercher une vie émotionnellement stable. Cependant, elle peut se traduire par un sentiment d’insécurité si les conditions extérieures mettent cette stabilité en question. Le changement exigeant souvent que nous trouvions des moyens de faire face à des orientations de valeur différentes des nôtres, les personnes ayant Famille comme perspective Majeure rechercheront conseil et orientation de personnes ayant un ascendant sur eux, ce se soit morale ou statutaire. Si nous sommes parent ou en position de leadership, les personnes sous notre responsabilité attendront de nous stabilité et orientation. Les situations de changement, surtout si elles sont de nature à remettre en cause notre autorité, requerront un surcroît inhabituel d’impartialité. Elles seront en tout cas l’occasion d’évaluer s’il s’agit d’acquérir de nouvelles compétences et, le cas échéant, de prendre des mesures pour répondre à nos besoins. Dans de telles circonstances il conviendra de rassembler autour de soi les bonnes personnes afin d’obtenir l’assistance nécessaire pour prendre les bonnes décisions et retrouver ainsi le chemin de la stabilité.",,Family,"The Grounding Perspective represents the need to fulfill the most basic requirements for life, such as shelter, physical mobility, and security, as well as the basic human emotional need for kindness, toward oneself and others. For many people at any given time, this cluster of values may need less conscious attention as they already operate “in the background.” But it is also natural for Grounding values to become more important, requiring more attention in times of stress and significant life change, for example because of illness or accident or prolonged financial or social pressure. Stress can also result from positive life events, such as embarking on demanding educational programs, taking on job roles that require expanded competencies, or starting a new family. As its name says, this Perspective is needed to ground us in a solid foundation for life, on which all other values rest. We most often see Grounding Perspective values prioritized by people who are post-secondary students, young parents, and people who are experiencing destabilizing life conditions. Societies that do not sufficiently prioritize the Grounding Perspective may fail to adequately ensure the basic conditions for life for their citizens and dependents, resulting homelessness or population displacement, unsafe communities, or preventable public health problems. For some people, the choice of Grounding values expresses a more generalized concern for the fundamental well-being of others. We all need to consciously re-evaluate Grounding values at every stage of life, in order to build, maintain, and when necessary, re-build our life foundations.","When the Grounding is the most highly energized or “core” perspective, it requires us to pay attention to issues of personal health, basic security, and/or physical mobility. In times of crisis or prolonged stresses, paying attention to the values in this Perspective means changing the things in life that have negative impacts that one can control, or by seeking help. If Grounding values are being triggered by life choices that result in temporary trade-offs such as financial or physical insecurity, it can help to pay attention to mental health and well-being in the short term and find ways to put energy into actions that will support the eventual return to one’s most desired values perspective in the long term. In that situation, acknowledging the importance of these values and addressing them consciously can be a first step in returning to a more stable, secure life condition."
